{"dataset":"fees","api_version":"v1","schema_version":"1.1.0","schema_url":"https://blockchains.github.io/blockchainlab-api/v1/schemas/fees.schema.json","description":"Protocol fees by protocol (top 300 by 24h). Snapshot from DefiLlama.","generated_at":"2026-10-17T07:50:33.758Z","source":"DefiLlama overview/fees","source_url":"https://api.llama.fi/overview/fees","built_by":"Blockchain Lab — https://blockchainlab.com","licence_note":"Data belongs to the named source; check its terms before reuse. Attribute the source and Blockchain Lab.","count":300,"totals":{"total_24h_usd":73956553,"total_7d_usd":551849624,"total_30d_usd":2409716915,"change_1d_pct":-18.92},"data":[{"rank":1,"name":"Tether","slug":"tether","category":"Stablecoin Issuer","chains":["Off Chain"],"total_24h_usd":17625945,"total_7d_usd":122823819,"total_30d_usd":521613854,"change_1d_pct":-0.21,"change_7d_pct":0.79,"defillama_url":"https://defillama.com/protocol/tether"},{"rank":2,"name":"Circle USDC","slug":"circle-usdc","category":"Stablecoin Issuer","chains":["Ethereum","Off Chain"],"total_24h_usd":7034833,"total_7d_usd":48995998,"total_30d_usd":211939496,"change_1d_pct":0.07,"change_7d_pct":0.64,"defillama_url":"https://defillama.com/protocol/circle-usdc"},{"rank":3,"name":"Papertrade","slug":"papertrade","category":"Derivatives","chains":["Off Chain"],"total_24h_usd":4864667,"total_7d_usd":55179076,"total_30d_usd":55179076,"change_1d_pct":-35.05,"change_7d_pct":null,"defillama_url":"https://defillama.com/protocol/papertrade"},{"rank":4,"name":"PumpSwap","slug":"pumpswap","category":"Dexs","chains":["Solana"],"total_24h_usd":3275768,"total_7d_usd":23490515,"total_30d_usd":118559823,"change_1d_pct":-1.85,"change_7d_pct":-19.09,"defillama_url":"https://defillama.com/protocol/pumpswap"},{"rank":5,"name":"Hyperliquid Perps","slug":"hyperliquid-perps","category":"Derivatives","chains":["Hyperliquid L1"],"total_24h_usd":3025918,"total_7d_usd":19592456,"total_30d_usd":85083580,"change_1d_pct":-30.21,"change_7d_pct":46.43,"defillama_url":"https://defillama.com/protocol/hyperliquid-perps"},{"rank":6,"name":"Polymarket US","slug":"polymarket-us","category":"Prediction Market","chains":["Off Chain"],"total_24h_usd":2204829,"total_7d_usd":20244538,"total_30d_usd":82981951,"change_1d_pct":14.34,"change_7d_pct":-22.66,"defillama_url":"https://defillama.com/protocol/polymarket-us"},{"rank":7,"name":"pump.fun","slug":"pump.fun","category":"Launchpad","chains":["Solana"],"total_24h_usd":1973403,"total_7d_usd":13999821,"total_30d_usd":61268009,"change_1d_pct":3.53,"change_7d_pct":-10.11,"defillama_url":"https://defillama.com/protocol/pump.fun"},{"rank":8,"name":"Lido","slug":"lido","category":"Liquid Staking","chains":["Ethereum"],"total_24h_usd":1610631,"total_7d_usd":11361424,"total_30d_usd":52015936,"change_1d_pct":2.97,"change_7d_pct":-2.34,"defillama_url":"https://defillama.com/protocol/lido"},{"rank":9,"name":"Uniswap V4","slug":"uniswap-v4","category":"Dexs","chains":["Ethereum","Unichain","OP Mainnet","Base","Arbitrum","Polygon","Blast","Zora","World Chain","Ink","Soneium","Avalanche","BSC","Monad","X Layer","MegaETH","Robinhood Chain","Celo","Tempo","Arc"],"total_24h_usd":1535214,"total_7d_usd":12313718,"total_30d_usd":77839330,"change_1d_pct":-10.51,"change_7d_pct":-14.64,"defillama_url":"https://defillama.com/protocol/uniswap-v4"},{"rank":10,"name":"Fragment","slug":"fragment","category":"NFT Marketplace","chains":["TON"],"total_24h_usd":1168227,"total_7d_usd":6972791,"total_30d_usd":31690010,"change_1d_pct":-5.37,"change_7d_pct":11.95,"defillama_url":"https://defillama.com/protocol/fragment"},{"rank":11,"name":"Aave V3","slug":"aave-v3","category":"Lending","chains":["Polygon","Fantom","Arbitrum","Avalanche","OP Mainnet","Ethereum","Metis","Base","Gnosis","BSC","Scroll","ZKsync Era","Linea","Celo","Sonic","Soneium","Plasma","Mantle","MegaETH","X Layer","Monad"],"total_24h_usd":1129198,"total_7d_usd":8442675,"total_30d_usd":37321916,"change_1d_pct":-21.05,"change_7d_pct":-5.53,"defillama_url":"https://defillama.com/protocol/aave-v3"},{"rank":12,"name":"Hyper Foundation HYPE Staking","slug":"hyper-foundation-hype-staking","category":"Staking Pool","chains":["Hyperliquid L1"],"total_24h_usd":1020054,"total_7d_usd":7380352,"total_30d_usd":34156951,"change_1d_pct":-2.53,"change_7d_pct":-4.83,"defillama_url":"https://defillama.com/protocol/hyper-foundation-hype-staking"},{"rank":13,"name":"Polymarket International","slug":"polymarket-international","category":"Prediction Market","chains":["Polygon"],"total_24h_usd":989059,"total_7d_usd":8007506,"total_30d_usd":29963703,"change_1d_pct":-14.53,"change_7d_pct":-4.39,"defillama_url":"https://defillama.com/protocol/polymarket-international"},{"rank":14,"name":"Tron","slug":"tron","category":"Chain","chains":["Tron"],"total_24h_usd":956285,"total_7d_usd":5841965,"total_30d_usd":23916676,"change_1d_pct":-4.97,"change_7d_pct":10.77,"defillama_url":"https://defillama.com/protocol/tron"},{"rank":15,"name":"Sky Lending","slug":"sky-lending","category":"CDP","chains":["Ethereum"],"total_24h_usd":956221,"total_7d_usd":6739671,"total_30d_usd":27655277,"change_1d_pct":-0.2,"change_7d_pct":-1.03,"defillama_url":"https://defillama.com/protocol/sky-lending"},{"rank":16,"name":"Axiom","slug":"axiom","category":"Trading App","chains":["Solana","BSC","Robinhood Chain"],"total_24h_usd":859712,"total_7d_usd":6103582,"total_30d_usd":36134335,"change_1d_pct":-0.38,"change_7d_pct":-6,"defillama_url":"https://defillama.com/protocol/axiom"},{"rank":17,"name":"Flap sh","slug":"flap-sh","category":"Launchpad","chains":["BSC","X Layer","Monad","Robinhood Chain"],"total_24h_usd":794876,"total_7d_usd":6446892,"total_30d_usd":34400628,"change_1d_pct":-11,"change_7d_pct":-12.51,"defillama_url":"https://defillama.com/protocol/flap-sh"},{"rank":18,"name":"Collector Crypt","slug":"collector-crypt","category":"Physical TCG","chains":["Solana","Base","Robinhood Chain"],"total_24h_usd":784020,"total_7d_usd":4046862,"total_30d_usd":16601907,"change_1d_pct":-20.7,"change_7d_pct":14.55,"defillama_url":"https://defillama.com/protocol/collector-crypt"},{"rank":19,"name":"Solana","slug":"solana","category":"Chain","chains":["Solana"],"total_24h_usd":774564,"total_7d_usd":5453521,"total_30d_usd":28240488,"change_1d_pct":-4.5,"change_7d_pct":-4.22,"defillama_url":"https://defillama.com/protocol/solana"},{"rank":20,"name":"Morpho Blue","slug":"morpho-blue","category":"Lending","chains":["Ethereum","Base","Arbitrum","OP Mainnet","Polygon","Fraxtal","Scroll","World Chain","Ink","Unichain","Hemi","Sonic","Corn","Mode","Hyperliquid L1","Soneium","Zircuit","Katana","Monad","Stable","Celo","Plume Mainnet","Abstract","Flare","Citrea","Etherlink","Tempo","Robinhood Chain","Morph","Pharos","Arc"],"total_24h_usd":760007,"total_7d_usd":5339228,"total_30d_usd":21826406,"change_1d_pct":-10.87,"change_7d_pct":-3.95,"defillama_url":"https://defillama.com/protocol/morpho-blue"},{"rank":21,"name":"Paxos Stablecoin Issuer","slug":"paxos-stablecoin-issuer","category":"Stablecoin Issuer","chains":["Off Chain"],"total_24h_usd":664655,"total_7d_usd":4646009,"total_30d_usd":19846607,"change_1d_pct":0.13,"change_7d_pct":-0.34,"defillama_url":"https://defillama.com/protocol/paxos-stablecoin-issuer"},{"rank":22,"name":"Spiko","slug":"spiko","category":"RWA","chains":["Polygon","Ethereum","Arbitrum","Base","Starknet","Stellar","Etherlink"],"total_24h_usd":651841,"total_7d_usd":6670686,"total_30d_usd":10700162,"change_1d_pct":-88.09,"change_7d_pct":28.06,"defillama_url":"https://defillama.com/protocol/spiko"},{"rank":23,"name":"Binance staked ETH","slug":"binance-staked-eth","category":"Liquid Staking","chains":["BSC","Ethereum"],"total_24h_usd":628886,"total_7d_usd":4395812,"total_30d_usd":19271109,"change_1d_pct":1.44,"change_7d_pct":-0.01,"defillama_url":"https://defillama.com/protocol/binance-staked-eth"},{"rank":24,"name":"Meteora DLMM","slug":"meteora-dlmm","category":"Dexs","chains":["Solana"],"total_24h_usd":620618,"total_7d_usd":4504542,"total_30d_usd":42376305,"change_1d_pct":5.58,"change_7d_pct":1.37,"defillama_url":"https://defillama.com/protocol/meteora-dlmm"},{"rank":25,"name":"Uniswap V3","slug":"uniswap-v3","category":"Dexs","chains":["Ethereum","Arbitrum","OP Mainnet","Polygon","Celo","BSC","ZKsync Era","Sei","Taiko","Scroll","Rootstock","Filecoin","Boba","Moonbeam","Manta","Mantle","Linea","Avalanche","Base","Polygon zkEVM","Blast","Gnosis","BOB","Lisk","Corn","Unichain","Hemi","Saga","LightLink","GOAT","XDC","Lens","Telos","World Chain","Nibiru","Plasma","Monad","Etherlink","Sonic","Zora","X Layer","Robinhood Chain","Ink","Tempo","0G","Arc","Redbelly"],"total_24h_usd":585789,"total_7d_usd":6885067,"total_30d_usd":39439856,"change_1d_pct":-62.18,"change_7d_pct":-21.65,"defillama_url":"https://defillama.com/protocol/uniswap-v3"},{"rank":26,"name":"Grayscale","slug":"grayscale","category":"RWA","chains":["Off Chain"],"total_24h_usd":585710,"total_7d_usd":4114638,"total_30d_usd":18085487,"change_1d_pct":0.71,"change_7d_pct":0.27,"defillama_url":"https://defillama.com/protocol/grayscale"},{"rank":27,"name":"BSC","slug":"bsc","category":"Chain","chains":["BSC"],"total_24h_usd":523695,"total_7d_usd":2794612,"total_30d_usd":16781590,"change_1d_pct":18.62,"change_7d_pct":76.68,"defillama_url":"https://defillama.com/protocol/bsc"},{"rank":28,"name":"Pons V2","slug":"pons-v2","category":"Launchpad","chains":["Robinhood Chain"],"total_24h_usd":477041,"total_7d_usd":3278104,"total_30d_usd":40850889,"change_1d_pct":10.01,"change_7d_pct":-12.65,"defillama_url":"https://defillama.com/protocol/pons-v2"},{"rank":29,"name":"pump.fun Mobile App","slug":"pump.fun-mobile-app","category":"Interface","chains":["Solana"],"total_24h_usd":393495,"total_7d_usd":2494747,"total_30d_usd":10359394,"change_1d_pct":7.11,"change_7d_pct":0.27,"defillama_url":"https://defillama.com/protocol/pump.fun-mobile-app"},{"rank":30,"name":"World Liberty Financial","slug":"world-liberty-financial","category":"